{
  "$schema": "https://json-schema.org/draft/2020-12/schema",
  "$id": "protocol.schema.json",
  "title": "Protocol (the day's plan, written by the agent)",
  "type": "object",
  "additionalProperties": false,
  "required": [
    "school_id",
    "date",
    "generated_at",
    "generator",
    "source",
    "overall_band",
    "summary",
    "decisions",
    "windows",
    "parent_notice",
    "disclaimer"
  ],
  "properties": {
    "school_id": {
      "type": "string"
    },
    "date": {
      "type": "string",
      "pattern": "^\\d{4}-\\d{2}-\\d{2}$",
      "description": "IST school day"
    },
    "generated_at": {
      "type": "string",
      "pattern": "^\\d{4}-\\d{2}-\\d{2}T\\d{2}:\\d{2}:\\d{2}Z$"
    },
    "generator": {
      "type": "object",
      "required": [
        "engine"
      ],
      "additionalProperties": false,
      "properties": {
        "engine": {
          "enum": [
            "strands-bedrock",
            "rules-fallback"
          ]
        },
        "model_id": {
          "type": "string"
        },
        "fallback_reason": {
          "type": "string"
        }
      }
    },
    "source": {
      "enum": [
        "live",
        "sample"
      ],
      "description": "sample if any input in the bundle was sample"
    },
    "overall_band": {
      "enum": [
        "green",
        "amber",
        "red"
      ]
    },
    "summary": {
      "type": "object",
      "required": [
        "en",
        "hi"
      ],
      "additionalProperties": false,
      "properties": {
        "en": {
          "type": "string",
          "minLength": 1
        },
        "hi": {
          "type": "string",
          "minLength": 1
        }
      }
    },
    "decisions": {
      "type": "array",
      "minItems": 1,
      "items": {
        "type": "object",
        "additionalProperties": false,
        "required": [
          "slot_id",
          "label",
          "start",
          "end",
          "action",
          "band",
          "reason",
          "citations"
        ],
        "properties": {
          "slot_id": {
            "type": "string"
          },
          "label": {
            "type": "string"
          },
          "start": {
            "type": "string",
            "pattern": "^([01]\\d|2[0-3]):[0-5]\\d$"
          },
          "end": {
            "type": "string",
            "pattern": "^([01]\\d|2[0-3]):[0-5]\\d$"
          },
          "action": {
            "enum": [
              "outdoor",
              "outdoor_reduced",
              "indoor"
            ]
          },
          "band": {
            "enum": [
              "green",
              "amber",
              "red"
            ]
          },
          "reason": {
            "type": "object",
            "required": [
              "en",
              "hi"
            ],
            "additionalProperties": false,
            "properties": {
              "en": {
                "type": "string",
                "minLength": 1
              },
              "hi": {
                "type": "string",
                "minLength": 1
              }
            }
          },
          "citations": {
            "type": "array",
            "minItems": 1,
            "items": {
              "type": "object",
              "required": [
                "ref",
                "value"
              ],
              "additionalProperties": false,
              "properties": {
                "ref": {
                  "type": "string",
                  "pattern": "^/(air|smoke|school)/",
                  "description": "JSON pointer into the TodayBundle"
                },
                "value": {
                  "description": "The value found at ref (checked by the agent validator)"
                },
                "note": {
                  "type": "string"
                }
              }
            }
          }
        }
      }
    },
    "windows": {
      "type": "array",
      "minItems": 1,
      "items": {
        "type": "object",
        "additionalProperties": false,
        "required": [
          "state",
          "start",
          "end",
          "reason",
          "citations"
        ],
        "properties": {
          "state": {
            "enum": [
              "open",
              "closed"
            ]
          },
          "start": {
            "type": "string",
            "pattern": "^([01]\\d|2[0-3]):[0-5]\\d$"
          },
          "end": {
            "type": "string",
            "pattern": "^([01]\\d|2[0-3]):[0-5]\\d$"
          },
          "reason": {
            "type": "object",
            "required": [
              "en",
              "hi"
            ],
            "additionalProperties": false,
            "properties": {
              "en": {
                "type": "string",
                "minLength": 1
              },
              "hi": {
                "type": "string",
                "minLength": 1
              }
            }
          },
          "citations": {
            "type": "array",
            "minItems": 1,
            "items": {
              "type": "object",
              "required": [
                "ref",
                "value"
              ],
              "additionalProperties": false,
              "properties": {
                "ref": {
                  "type": "string",
                  "pattern": "^/(air|smoke|school)/",
                  "description": "JSON pointer into the TodayBundle"
                },
                "value": {
                  "description": "The value found at ref (checked by the agent validator)"
                },
                "note": {
                  "type": "string"
                }
              }
            }
          }
        }
      }
    },
    "parent_notice": {
      "type": "object",
      "required": [
        "en",
        "hi"
      ],
      "additionalProperties": false,
      "properties": {
        "en": {
          "type": "string",
          "minLength": 1
        },
        "hi": {
          "type": "string",
          "minLength": 1
        }
      }
    },
    "disclaimer": {
      "type": "object",
      "required": [
        "en",
        "hi"
      ],
      "additionalProperties": false,
      "properties": {
        "en": {
          "type": "string",
          "minLength": 1
        },
        "hi": {
          "type": "string",
          "minLength": 1
        }
      }
    }
  }
}
