{
 "school_id": "sample-dwarka",
 "date": "2026-10-12",
 "generated_at": "2026-10-12T01:30:00Z",
 "generator": {
  "engine": "rules-fallback",
  "fallback_reason": "mock"
 },
 "source": "sample",
 "overall_band": "amber",
 "summary": {
  "en": "Amber air day (SAMPLE DATA): 2 of 4 outdoor slots move indoors. Smoke likely by 14:00: the air reaching school then will have passed over 16 farm fires, mostly in Kaithal (Haryana), Sangrur (Punjab) and Jind (Haryana).",
  "hi": "आज हवा नारंगी बैंड में (सैंपल डेटा): 4 में से 2 बाहरी गतिविधियाँ अंदर होंगी। दोपहर 2 बजे तक धुएँ की संभावना: तब स्कूल पहुँचने वाली हवा 16 खेतों की आग के ऊपर से गुज़री होगी, ज़्यादातर कैथल (हरियाणा), संगरूर (पंजाब) और जींद (हरियाणा) में।"
 },
 "decisions": [
  {
   "slot_id": "assembly",
   "label": "Morning assembly",
   "start": "07:40",
   "end": "08:00",
   "action": "outdoor_reduced",
   "band": "amber",
   "reason": {
    "en": "PM2.5 up to 106 µg/m³ during this slot (amber: short, light outdoor only).",
    "hi": "इस समय PM2.5 106 µg/m³ तक रहने का अनुमान (बाहर केवल थोड़ी और हल्की गतिविधि)।"
   },
   "citations": [
    {
     "ref": "/air/hours/1/pm25",
     "value": 106.0,
     "note": "highest hourly PM2.5 during Morning assembly"
    }
   ]
  },
  {
   "slot_id": "recess",
   "label": "Recess",
   "start": "10:40",
   "end": "11:10",
   "action": "outdoor",
   "band": "green",
   "reason": {
    "en": "PM2.5 up to 54 µg/m³ during this slot (green: outdoor ok).",
    "hi": "इस समय PM2.5 54 µg/m³ तक रहने का अनुमान (बाहर गतिविधि ठीक)।"
   },
   "citations": [
    {
     "ref": "/air/hours/4/pm25",
     "value": 54.0,
     "note": "highest hourly PM2.5 during Recess"
    }
   ]
  },
  {
   "slot_id": "pe",
   "label": "PE (Classes 6-8)",
   "start": "14:00",
   "end": "14:40",
   "action": "indoor",
   "band": "amber",
   "reason": {
    "en": "PM2.5 up to 88.5 µg/m³ during this slot (amber: short, light outdoor only). Farm-fire smoke likely (16 fires on the wind path), so one step more cautious.",
    "hi": "इस समय PM2.5 88.5 µg/m³ तक रहने का अनुमान (बाहर केवल थोड़ी और हल्की गतिविधि)। खेतों की आग का धुआँ आने की संभावना (16 आग हवा के रास्ते में), इसलिए एक कदम ज़्यादा सावधानी।"
   },
   "citations": [
    {
     "ref": "/air/hours/8/pm25",
     "value": 88.5,
     "note": "highest hourly PM2.5 during PE (Classes 6-8)"
    },
    {
     "ref": "/smoke/afternoon/smoke_likely",
     "value": true,
     "note": "indicative smoke trace"
    },
    {
     "ref": "/smoke/afternoon/fire_count",
     "value": 16
    }
   ]
  },
  {
   "slot_id": "dispersal",
   "label": "Dispersal",
   "start": "14:40",
   "end": "15:00",
   "action": "indoor",
   "band": "amber",
   "reason": {
    "en": "PM2.5 up to 88.5 µg/m³ during this slot (amber: short, light outdoor only). Farm-fire smoke likely (16 fires on the wind path), so one step more cautious.",
    "hi": "इस समय PM2.5 88.5 µg/m³ तक रहने का अनुमान (बाहर केवल थोड़ी और हल्की गतिविधि)। खेतों की आग का धुआँ आने की संभावना (16 आग हवा के रास्ते में), इसलिए एक कदम ज़्यादा सावधानी।"
   },
   "citations": [
    {
     "ref": "/air/hours/8/pm25",
     "value": 88.5,
     "note": "highest hourly PM2.5 during Dispersal"
    },
    {
     "ref": "/smoke/afternoon/smoke_likely",
     "value": true,
     "note": "indicative smoke trace"
    },
    {
     "ref": "/smoke/afternoon/fire_count",
     "value": 16
    }
   ]
  }
 ],
 "windows": [
  {
   "state": "closed",
   "start": "07:40",
   "end": "10:30",
   "reason": {
    "en": "PM2.5 up to 106 µg/m³: keep windows and doors closed.",
    "hi": "PM2.5 106 µg/m³ तक: खिड़कियाँ और दरवाज़े बंद रखें।"
   },
   "citations": [
    {
     "ref": "/air/hours/1/pm25",
     "value": 106.0
    }
   ]
  },
  {
   "state": "open",
   "start": "10:30",
   "end": "13:30",
   "reason": {
    "en": "Air is in the green band (PM2.5 47 µg/m³ or lower): open windows to ventilate.",
    "hi": "हवा हरे बैंड में है (PM2.5 47 µg/m³ या कम): हवा आने के लिए खिड़कियाँ खोलें।"
   },
   "citations": [
    {
     "ref": "/air/hours/6/pm25",
     "value": 47.0
    }
   ]
  },
  {
   "state": "closed",
   "start": "13:30",
   "end": "15:00",
   "reason": {
    "en": "PM2.5 up to 88.5 µg/m³: keep windows and doors closed.",
    "hi": "PM2.5 88.5 µg/m³ तक: खिड़कियाँ और दरवाज़े बंद रखें।"
   },
   "citations": [
    {
     "ref": "/air/hours/8/pm25",
     "value": 88.5
    }
   ]
  }
 ],
 "parent_notice": {
  "en": "Dear parents,\nThe air near Sample Public School, Dwarka (demo) on 2026-10-12 is expected to be in our amber band (short, light outdoor only). Today's plan:\n- Morning assembly (07:40): outdoors but short and light, no running\n- Recess (10:40): outdoors as planned\n- PE (Classes 6-8) (14:00): move indoors\n- Dispersal (14:40): move indoors\nPlease send your child with a well-fitting mask for the journey to and from school. We will keep outdoor exertion to a minimum.\nThank you, School Office",
  "hi": "प्रिय अभिभावकगण,\n2026-10-12 को सैंपल पब्लिक स्कूल, द्वारका (डेमो) के आसपास हवा हमारे नारंगी बैंड (बाहर केवल थोड़ी और हल्की गतिविधि) में रहने का अनुमान है। आज की योजना:\n- सुबह की प्रार्थना सभा (07:40): बाहर, पर छोटा और हल्का, दौड़-भाग नहीं\n- मध्यावकाश (10:40): बाहर, योजना के अनुसार\n- खेलकूद (कक्षा 6-8) (14:00): अंदर करें\n- छुट्टी (14:40): अंदर करें\nकृपया स्कूल आते-जाते समय बच्चे को अच्छी तरह फ़िट होने वाला मास्क पहनाकर भेजें। हम बाहर की थकाने वाली गतिविधियाँ कम से कम रखेंगे।\nधन्यवाद, स्कूल कार्यालय"
 },
 "disclaimer": {
  "en": "Indicative guidance from model forecasts (CAMS via Open-Meteo) and an indicative wind back-trajectory smoke trace. Bands are a school rule, not an official standard. Official GRAP/CAQM and Directorate of Education orders always take precedence.",
  "hi": "यह सलाह मॉडल पूर्वानुमान और हवा के रुख़ से धुएँ के संकेतात्मक अनुमान पर आधारित है। बैंड स्कूल का अपना नियम है, कोई आधिकारिक मानक नहीं। सरकारी GRAP/CAQM और शिक्षा निदेशालय के आदेश हमेशा मान्य होंगे।"
 }
}
